{
  "task_id": "SYN_002",
  "title": "Map daily activity aggregate to activity summary",
  "split": "synthetic",
  "difficulty": "easy",
  "source_family": "synthetic_daily_activity_aggregate",
  "target_entity": "synthetic_daily_activity_summary",
  "task_text": "Map one daily aggregate record into one activity summary object.",
  "source_schema": {
    "type": "object",
    "title": "SyntheticDailyActivityAggregate",
    "properties": {
      "TS": {
        "type": "string"
      },
      "ROW_ID": {
        "type": "integer"
      },
      "STEP_TOTAL": {
        "type": "string"
      },
      "DIST_M": {
        "type": "string"
      },
      "ACTIVE_KCAL": {
        "type": "string"
      }
    },
    "required": [
      "TS",
      "ROW_ID",
      "STEP_TOTAL",
      "DIST_M",
      "ACTIVE_KCAL"
    ],
    "additionalProperties": false
  },
  "target_schema": {
    "type": "object",
    "title": "SyntheticDailyActivitySummary",
    "properties": {
      "source_row_id": {
        "type": "integer"
      },
      "date": {
        "type": "string"
      },
      "steps_sum": {
        "type": "integer"
      },
      "distance_sum_m": {
        "type": "number"
      },
      "active_kcal_sum": {
        "type": "integer"
      }
    },
    "required": [
      "source_row_id",
      "date",
      "steps_sum",
      "distance_sum_m",
      "active_kcal_sum"
    ],
    "additionalProperties": false
  },
  "fixture_refs": {
    "input": "../../../fixtures/synthetic/SYN_002_input.json",
    "expected": "../../../fixtures/synthetic/SYN_002_expected.json"
  },
  "gold_refs": {
    "matches": "../../../gold/matches/SYN_002_matches.json",
    "plan": "../../../gold/plans/SYN_002_plan.json",
    "invariants": "../../../gold/invariants/SYN_002_invariants.json"
  },
  "tags": [
    "synthetic",
    "flat",
    "numeric-summary"
  ],
  "downstream_checks": [],
  "notes": [
    "Synthetic native task.",
    "Generated by scripts/generate_synthetic_tasks.py."
  ]
}
