{
  "task_id": "GB_003",
  "title": "Map NAVIGATE_APP to navigation_event",
  "split": "gamebus",
  "difficulty": "easy",
  "source_family": "gamebus_navigate_app",
  "target_entity": "navigation_event",
  "task_text": "Create one canonical navigation event JSON object from one GameBus NAVIGATE_APP record.",
  "source_schema": {
    "type": "object",
    "properties": {
      "X_DATE": {
        "type": "string"
      },
      "X_ACTIVITY_ID": {
        "type": [
          "integer",
          "string"
        ]
      },
      "APP": {
        "type": "string"
      },
      "SESSION": {
        "type": "string"
      },
      "UID": {
        "type": "string"
      },
      "FOR_CAMPAIGN": {
        "type": "string"
      },
      "URI": {
        "type": "string"
      }
    },
    "additionalProperties": false,
    "required": [
      "X_DATE",
      "X_ACTIVITY_ID",
      "APP",
      "SESSION",
      "UID",
      "FOR_CAMPAIGN",
      "URI"
    ],
    "title": "GameBusNavigateAppRecord"
  },
  "target_schema": {
    "type": "object",
    "properties": {
      "event_time": {
        "type": "string"
      },
      "source_activity_id": {
        "type": "integer"
      },
      "app": {
        "type": "string"
      },
      "session_id": {
        "type": "string"
      },
      "user_external_id": {
        "type": "string"
      },
      "campaign": {
        "type": "string"
      },
      "uri": {
        "type": "string"
      }
    },
    "additionalProperties": false,
    "required": [
      "event_time",
      "source_activity_id",
      "app",
      "session_id",
      "user_external_id",
      "campaign",
      "uri"
    ],
    "title": "NavigationEvent"
  },
  "fixture_refs": {
    "input": "benchmark/fixtures/gamebus/GB_003_input.json",
    "expected": "benchmark/fixtures/gamebus/GB_003_expected.json"
  },
  "gold_refs": {
    "matches": "benchmark/gold/matches/GB_003_matches.json",
    "plan": "benchmark/gold/plans/GB_003_plan.json",
    "invariants": "benchmark/gold/invariants/GB_003_invariants.json"
  },
  "tags": [
    "gamebus",
    "event",
    "session-metadata",
    "datetime"
  ],
  "notes": [
    "GameBus-derived task; fixtures are sanitized/synthetic."
  ]
}