{
  "task_id": "SYN_105",
  "title": "Copy/rename primitive: birth_date / multilingual",
  "split": "synthetic",
  "difficulty": "easy",
  "source_family": "synthetic_copy_rename",
  "target_entity": "canonical_user_profile",
  "task_text": "Map source field 'fecha_nacimiento' to target field 'birth_date'.",
  "primitive_family": "copy_rename",
  "primitive_subtype": "multilingual",
  "lexical_perturbation": "multilingual",
  "ambiguity_class": "single_gold",
  "composition_depth": 1,
  "difficulty_axes": {
    "num_source_objects": 1,
    "num_target_fields": 1,
    "num_joins": 0,
    "num_aggregations": 0,
    "nesting_depth": 0,
    "has_enum_normalization": false,
    "has_time_normalization": false
  },
  "source_schema": {
    "type": "object",
    "title": "SYN_105Source",
    "properties": {
      "fecha_nacimiento": {
        "type": "string"
      }
    },
    "required": [
      "fecha_nacimiento"
    ],
    "additionalProperties": false
  },
  "target_schema": {
    "type": "object",
    "title": "SYN_105Target",
    "properties": {
      "birth_date": {
        "type": "string"
      }
    },
    "required": [
      "birth_date"
    ],
    "additionalProperties": false
  },
  "fixture_refs": {
    "input": "../../../fixtures/synthetic/SYN_105_input.json",
    "expected": "../../../fixtures/synthetic/SYN_105_expected.json"
  },
  "gold_refs": {
    "matches": "../../../gold/matches/SYN_105_matches.json",
    "plan": "../../../gold/plans/SYN_105_plan.json",
    "invariants": "../../../gold/invariants/SYN_105_invariants.json"
  },
  "tags": [
    "synthetic",
    "primitive",
    "copy_rename",
    "birth_date",
    "multilingual"
  ],
  "notes": [
    "Spanish source term."
  ],
  "downstream_checks": [
    {
      "type": "required_fields_present",
      "fields": [
        "birth_date"
      ],
      "scope": "all_records"
    }
  ]
}