{
  "task_id": "PUB_104",
  "title": "Map FHIR Observation nutrition summary to daily_nutrition_summary",
  "split": "public",
  "difficulty": "medium",
  "source_family": "fhir_nutrition_summary_observation",
  "target_entity": "daily_nutrition_summary",
  "task_text": "Create one GameBus-like daily nutrition summary from one FHIR Observation with nutrition components.",
  "source_schema": {
    "type": "object",
    "properties": {
      "resourceType": {
        "type": "string",
        "const": "Observation"
      },
      "id": {
        "type": "string"
      },
      "effectiveDateTime": {
        "type": "string"
      },
      "component": {
        "type": "array",
        "items": {
          "type": "object",
          "properties": {
            "code": {
              "type": "object",
              "properties": {
                "text": {
                  "type": "string"
                }
              },
              "additionalProperties": false
            },
            "valueInteger": {
              "type": "integer"
            },
            "valueString": {
              "type": "string"
            }
          },
          "additionalProperties": false,
          "required": [
            "code"
          ]
        }
      }
    },
    "additionalProperties": false,
    "required": [
      "resourceType",
      "id",
      "effectiveDateTime",
      "component"
    ],
    "title": "FHIRNutritionSummaryObservation"
  },
  "target_schema": {
    "type": "object",
    "properties": {
      "source_activity_id": {
        "type": "string"
      },
      "date": {
        "type": "string"
      },
      "aggregation_level": {
        "type": "string"
      },
      "summary_score": {
        "type": "integer"
      },
      "carbs_conformance": {
        "type": "integer"
      },
      "fat_conformance": {
        "type": "integer"
      },
      "fiber_conformance": {
        "type": "integer"
      }
    },
    "additionalProperties": false,
    "required": [
      "source_activity_id",
      "date",
      "aggregation_level",
      "summary_score",
      "carbs_conformance",
      "fat_conformance",
      "fiber_conformance"
    ],
    "title": "DailyNutritionSummary"
  },
  "fixture_refs": {
    "input": "benchmark/fixtures/public/PUB_104_input.json",
    "expected": "benchmark/fixtures/public/PUB_104_expected.json"
  },
  "gold_refs": {
    "matches": "benchmark/gold/matches/PUB_104_matches.json",
    "plan": "benchmark/gold/plans/PUB_104_plan.json",
    "invariants": "benchmark/gold/invariants/PUB_104_invariants.json"
  },
  "tags": [
    "public",
    "fhir",
    "interop",
    "nutrition",
    "gamebus-shaped"
  ],
  "downstream_checks": [
    {
      "type": "record_count_matches_expected"
    },
    {
      "type": "required_fields_present",
      "fields": [
        "source_activity_id",
        "date",
        "aggregation_level",
        "summary_score",
        "carbs_conformance",
        "fat_conformance",
        "fiber_conformance"
      ],
      "scope": "all_records"
    },
    {
      "type": "field_types",
      "fields": {
        "source_activity_id": "string",
        "date": "date-string",
        "aggregation_level": "string",
        "summary_score": "integer",
        "carbs_conformance": "integer",
        "fat_conformance": "integer",
        "fiber_conformance": "integer"
      },
      "scope": "all_records"
    }
  ],
  "notes": [
    "Public anchor task.",
    "Hand-built public task generated by build_public_tasks.py."
  ]
}