{
  "task_id": "SYN_006",
  "title": "Group payment events into customer payment summaries",
  "split": "synthetic",
  "difficulty": "medium",
  "source_family": "synthetic_payment_event",
  "target_entity": "synthetic_customer_payment_summary",
  "task_text": "Group payment events by customer and compute summary fields.",
  "source_schema": {
    "type": "object",
    "title": "SyntheticPaymentEvent",
    "properties": {
      "event_id": {
        "type": "string"
      },
      "customer_id": {
        "type": "string"
      },
      "currency": {
        "type": "string"
      },
      "created_at": {
        "type": "string"
      },
      "amount_minor": {
        "type": "integer"
      }
    },
    "required": [
      "event_id",
      "customer_id",
      "currency",
      "created_at",
      "amount_minor"
    ],
    "additionalProperties": false
  },
  "target_schema": {
    "type": "object",
    "title": "SyntheticCustomerPaymentSummary",
    "properties": {
      "customer_id": {
        "type": "string"
      },
      "currency": {
        "type": "string"
      },
      "payment_count": {
        "type": "integer"
      },
      "total_amount_minor": {
        "type": "number"
      },
      "first_payment_time": {
        "type": "string"
      },
      "last_payment_time": {
        "type": "string"
      }
    },
    "required": [
      "customer_id",
      "currency",
      "payment_count",
      "total_amount_minor",
      "first_payment_time",
      "last_payment_time"
    ],
    "additionalProperties": false
  },
  "fixture_refs": {
    "input": "../../../fixtures/synthetic/SYN_006_input.json",
    "expected": "../../../fixtures/synthetic/SYN_006_expected.json"
  },
  "gold_refs": {
    "matches": "../../../gold/matches/SYN_006_matches.json",
    "plan": "../../../gold/plans/SYN_006_plan.json",
    "invariants": "../../../gold/invariants/SYN_006_invariants.json"
  },
  "tags": [
    "synthetic",
    "grouped-execution",
    "aggregation"
  ],
  "downstream_checks": [
    {
      "type": "record_count_matches_expected"
    },
    {
      "type": "required_fields_present",
      "fields": [
        "customer_id",
        "currency",
        "payment_count",
        "total_amount_minor",
        "first_payment_time",
        "last_payment_time"
      ],
      "scope": "all_records"
    }
  ],
  "notes": [
    "Synthetic native task.",
    "Generated by scripts/generate_synthetic_tasks.py."
  ]
}
