{
  "task_id": "SYN_004",
  "title": "Map embedded JSON consent payload to consent record",
  "split": "synthetic",
  "difficulty": "medium",
  "source_family": "synthetic_embedded_json_consent",
  "target_entity": "synthetic_consent_record",
  "task_text": "Parse a JSON string and derive consent summary fields.",
  "source_schema": {
    "type": "object",
    "title": "SyntheticConsentPayloadRecord",
    "properties": {
      "TS": {
        "type": "string"
      },
      "EVENT_ID": {
        "type": "integer"
      },
      "CAMPAIGN_CODE": {
        "type": "string"
      },
      "CONSENT_PAYLOAD": {
        "type": "string"
      }
    },
    "required": [
      "TS",
      "EVENT_ID",
      "CAMPAIGN_CODE",
      "CONSENT_PAYLOAD"
    ],
    "additionalProperties": false
  },
  "target_schema": {
    "type": "object",
    "title": "SyntheticConsentRecord",
    "properties": {
      "consent_time": {
        "type": "string"
      },
      "source_event_id": {
        "type": "integer"
      },
      "campaign": {
        "type": "string"
      },
      "consent_items": {
        "type": "array"
      },
      "accepted_count": {
        "type": "integer"
      },
      "item_count": {
        "type": "integer"
      },
      "all_required_accepted": {
        "type": "boolean"
      }
    },
    "required": [
      "consent_time",
      "source_event_id",
      "campaign",
      "consent_items",
      "accepted_count",
      "item_count",
      "all_required_accepted"
    ],
    "additionalProperties": false
  },
  "fixture_refs": {
    "input": "../../../fixtures/synthetic/SYN_004_input.json",
    "expected": "../../../fixtures/synthetic/SYN_004_expected.json"
  },
  "gold_refs": {
    "matches": "../../../gold/matches/SYN_004_matches.json",
    "plan": "../../../gold/plans/SYN_004_plan.json",
    "invariants": "../../../gold/invariants/SYN_004_invariants.json"
  },
  "tags": [
    "synthetic",
    "embedded-json",
    "boolean-aggregation"
  ],
  "downstream_checks": [],
  "notes": [
    "Synthetic native task.",
    "Generated by scripts/generate_synthetic_tasks.py."
  ]
}
