{
  "task_id": "SYN_008",
  "title": "Filter active records and normalize score",
  "split": "synthetic",
  "difficulty": "medium",
  "source_family": "synthetic_filtered_score_record",
  "target_entity": "synthetic_filtered_score",
  "task_text": "Keep only active records and normalize score/date fields.",
  "source_schema": {
    "type": "object",
    "title": "SyntheticFilteredScoreRecord",
    "properties": {
      "record_id": {
        "type": "integer"
      },
      "status": {
        "type": "string"
      },
      "score": {
        "type": "string"
      },
      "ts": {
        "type": "string"
      }
    },
    "required": [
      "record_id",
      "status",
      "score",
      "ts"
    ],
    "additionalProperties": false
  },
  "target_schema": {
    "type": "object",
    "title": "SyntheticFilteredScore",
    "properties": {
      "record_id": {
        "type": "integer"
      },
      "score": {
        "type": "integer"
      },
      "date": {
        "type": "string"
      }
    },
    "required": [
      "record_id",
      "score",
      "date"
    ],
    "additionalProperties": false
  },
  "fixture_refs": {
    "input": "../../../fixtures/synthetic/SYN_008_input.json",
    "expected": "../../../fixtures/synthetic/SYN_008_expected.json"
  },
  "gold_refs": {
    "matches": "../../../gold/matches/SYN_008_matches.json",
    "plan": "../../../gold/plans/SYN_008_plan.json",
    "invariants": "../../../gold/invariants/SYN_008_invariants.json"
  },
  "tags": [
    "synthetic",
    "filtering",
    "casting"
  ],
  "downstream_checks": [],
  "notes": [
    "Synthetic native task.",
    "Generated by scripts/generate_synthetic_tasks.py."
  ]
}
