{
  "task_id": "SYN_001",
  "title": "Map daily nutrient metrics to nutrient summary",
  "split": "synthetic",
  "difficulty": "easy",
  "source_family": "synthetic_daily_nutrient_metrics",
  "target_entity": "synthetic_daily_nutrient_summary",
  "task_text": "Map one flat source record into one canonical daily nutrient summary object.",
  "source_schema": {
    "type": "object",
    "title": "SyntheticDailyNutrientRecord",
    "properties": {
      "EVENT_TS": {
        "type": "string"
      },
      "EVENT_ID": {
        "type": "integer"
      },
      "LEVEL": {
        "type": "string"
      },
      "TOTAL_SCORE": {
        "type": "string"
      },
      "PROTEIN_SCORE": {
        "type": "string"
      },
      "SUGAR_SCORE": {
        "type": "string"
      }
    },
    "required": [
      "EVENT_TS",
      "EVENT_ID",
      "LEVEL",
      "TOTAL_SCORE",
      "PROTEIN_SCORE",
      "SUGAR_SCORE"
    ],
    "additionalProperties": false
  },
  "target_schema": {
    "type": "object",
    "title": "SyntheticDailyNutrientSummary",
    "properties": {
      "source_event_id": {
        "type": "integer"
      },
      "date": {
        "type": "string"
      },
      "level": {
        "type": "string"
      },
      "total_score": {
        "type": "integer"
      },
      "protein_score": {
        "type": "integer"
      },
      "sugar_score": {
        "type": "integer"
      }
    },
    "required": [
      "source_event_id",
      "date",
      "level",
      "total_score",
      "protein_score",
      "sugar_score"
    ],
    "additionalProperties": false
  },
  "fixture_refs": {
    "input": "../../../fixtures/synthetic/SYN_001_input.json",
    "expected": "../../../fixtures/synthetic/SYN_001_expected.json"
  },
  "gold_refs": {
    "matches": "../../../gold/matches/SYN_001_matches.json",
    "plan": "../../../gold/plans/SYN_001_plan.json",
    "invariants": "../../../gold/invariants/SYN_001_invariants.json"
  },
  "tags": [
    "synthetic",
    "flat",
    "casting",
    "date-normalization"
  ],
  "downstream_checks": [],
  "notes": [
    "Synthetic native task.",
    "Generated by scripts/generate_synthetic_tasks.py."
  ]
}
