{
  "task_id": "PUB_102",
  "title": "Map FHIR QuestionnaireResponse to general_survey_profile",
  "split": "public",
  "difficulty": "medium",
  "source_family": "fhir_questionnaire_response",
  "target_entity": "general_survey_profile",
  "task_text": "Create one GameBus-like general survey profile from one FHIR QuestionnaireResponse.",
  "source_schema": {
    "type": "object",
    "properties": {
      "resourceType": {
        "type": "string",
        "const": "QuestionnaireResponse"
      },
      "id": {
        "type": "string"
      },
      "authored": {
        "type": "string"
      },
      "item": {
        "type": "array",
        "items": {
          "type": "object",
          "properties": {
            "linkId": {
              "type": "string"
            },
            "text": {
              "type": "string"
            },
            "answer": {
              "type": "array",
              "items": {
                "type": "object",
                "properties": {
                  "valueString": {
                    "type": "string"
                  },
                  "valueInteger": {
                    "type": "integer"
                  }
                },
                "additionalProperties": false
              }
            }
          },
          "additionalProperties": false,
          "required": [
            "linkId",
            "answer"
          ]
        }
      }
    },
    "additionalProperties": false,
    "required": [
      "resourceType",
      "id",
      "authored",
      "item"
    ],
    "title": "FHIRQuestionnaireResponse"
  },
  "target_schema": {
    "type": "object",
    "properties": {
      "survey_time": {
        "type": "string"
      },
      "source_activity_id": {
        "type": "string"
      },
      "gender": {
        "type": [
          "string",
          "null"
        ]
      },
      "age": {
        "type": [
          "integer",
          "null"
        ]
      },
      "raw_pairs": {
        "type": "array",
        "items": {
          "type": "string"
        }
      }
    },
    "additionalProperties": false,
    "required": [
      "survey_time",
      "source_activity_id",
      "raw_pairs"
    ],
    "title": "GeneralSurveyProfile"
  },
  "fixture_refs": {
    "input": "benchmark/fixtures/public/PUB_102_input.json",
    "expected": "benchmark/fixtures/public/PUB_102_expected.json"
  },
  "gold_refs": {
    "matches": "benchmark/gold/matches/PUB_102_matches.json",
    "plan": "benchmark/gold/plans/PUB_102_plan.json",
    "invariants": "benchmark/gold/invariants/PUB_102_invariants.json"
  },
  "tags": [
    "public",
    "fhir",
    "interop",
    "survey",
    "gamebus-shaped"
  ],
  "downstream_checks": [
    {
      "type": "record_count_matches_expected"
    },
    {
      "type": "required_fields_present",
      "fields": [
        "survey_time",
        "source_activity_id",
        "raw_pairs"
      ],
      "scope": "all_records"
    },
    {
      "type": "field_types",
      "fields": {
        "survey_time": "datetime-string",
        "source_activity_id": "string",
        "gender": "string-or-null",
        "age": "integer-or-null"
      },
      "scope": "all_records"
    }
  ],
  "notes": [
    "Public anchor task.",
    "Hand-built public task generated by build_public_tasks.py."
  ]
}