{
  "task_id": "PUB_106",
  "title": "Map joined order and customer bundles to order_with_customer",
  "split": "public",
  "difficulty": "medium",
  "source_family": "openapi_order_customer_bundle",
  "target_entity": "order_with_customer",
  "task_text": "Create one canonical order_with_customer JSON object per order by joining orders with customers on customer_id.",
  "source_schema": {
    "type": "object",
    "properties": {
      "orders": {
        "type": "array",
        "items": {
          "type": "object",
          "properties": {
            "id": {
              "type": "string"
            },
            "customer_id": {
              "type": "string"
            },
            "status": {
              "type": "string"
            },
            "total_amount": {
              "type": "number"
            }
          },
          "additionalProperties": false,
          "required": [
            "id",
            "customer_id",
            "status",
            "total_amount"
          ]
        }
      },
      "customers": {
        "type": "array",
        "items": {
          "type": "object",
          "properties": {
            "id": {
              "type": "string"
            },
            "email": {
              "type": "string"
            },
            "country": {
              "type": "string"
            },
            "tier": {
              "type": "string"
            }
          },
          "additionalProperties": false,
          "required": [
            "id",
            "email",
            "country",
            "tier"
          ]
        }
      }
    },
    "additionalProperties": false,
    "required": [
      "orders",
      "customers"
    ],
    "title": "OrderCustomerBundle"
  },
  "target_schema": {
    "type": "object",
    "properties": {
      "order_id": {
        "type": "string"
      },
      "customer_id": {
        "type": "string"
      },
      "customer_email": {
        "type": [
          "string",
          "null"
        ]
      },
      "customer_country": {
        "type": [
          "string",
          "null"
        ]
      },
      "customer_tier": {
        "type": [
          "string",
          "null"
        ]
      },
      "order_status": {
        "type": "string"
      },
      "total_amount": {
        "type": "number"
      }
    },
    "additionalProperties": false,
    "required": [
      "order_id",
      "customer_id",
      "customer_email",
      "customer_country",
      "customer_tier",
      "order_status",
      "total_amount"
    ],
    "title": "OrderWithCustomer"
  },
  "fixture_refs": {
    "input": "benchmark/fixtures/public/PUB_106_input.json",
    "expected": "benchmark/fixtures/public/PUB_106_expected.json"
  },
  "gold_refs": {
    "matches": "benchmark/gold/matches/PUB_106_matches.json",
    "plan": "benchmark/gold/plans/PUB_106_plan.json",
    "invariants": "benchmark/gold/invariants/PUB_106_invariants.json"
  },
  "tags": [
    "public",
    "openapi",
    "join",
    "commerce",
    "customer",
    "order"
  ],
  "downstream_checks": [
    {
      "type": "record_count_matches_expected"
    },
    {
      "type": "required_fields_present",
      "fields": [
        "order_id",
        "customer_id",
        "order_status",
        "total_amount"
      ],
      "scope": "all_records"
    },
    {
      "type": "field_types",
      "fields": {
        "order_id": "string",
        "customer_id": "string",
        "customer_email": "string-or-null",
        "customer_country": "string-or-null",
        "customer_tier": "string-or-null",
        "order_status": "string",
        "total_amount": "number"
      },
      "scope": "all_records"
    }
  ],
  "notes": [
    "Public anchor task.",
    "Hand-built public task generated by build_public_tasks.py."
  ]
}