{
  "task_id": "PUB_105",
  "title": "Map payment events to customer_payment_summary",
  "split": "public",
  "difficulty": "medium",
  "source_family": "openapi_payment_event",
  "target_entity": "customer_payment_summary",
  "task_text": "Create one customer_payment_summary JSON object per customer from a bundle of payment event records.",
  "source_schema": {
    "type": "object",
    "properties": {
      "event_id": {
        "type": "string"
      },
      "customer_id": {
        "type": "string"
      },
      "currency": {
        "type": "string"
      },
      "status": {
        "type": "string"
      },
      "created_at": {
        "type": "string"
      },
      "amount_minor": {
        "type": "integer"
      }
    },
    "additionalProperties": false,
    "required": [
      "event_id",
      "customer_id",
      "currency",
      "status",
      "created_at",
      "amount_minor"
    ],
    "title": "PaymentEventRecord"
  },
  "target_schema": {
    "type": "object",
    "properties": {
      "customer_id": {
        "type": "string"
      },
      "currency": {
        "type": "string"
      },
      "payment_count": {
        "type": "integer"
      },
      "total_amount_minor": {
        "type": "number"
      },
      "first_payment_time": {
        "type": "string"
      },
      "last_payment_time": {
        "type": "string"
      }
    },
    "additionalProperties": false,
    "required": [
      "customer_id",
      "currency",
      "payment_count",
      "total_amount_minor",
      "first_payment_time",
      "last_payment_time"
    ],
    "title": "CustomerPaymentSummary"
  },
  "fixture_refs": {
    "input": "benchmark/fixtures/public/PUB_105_input.json",
    "expected": "benchmark/fixtures/public/PUB_105_expected.json"
  },
  "gold_refs": {
    "matches": "benchmark/gold/matches/PUB_105_matches.json",
    "plan": "benchmark/gold/plans/PUB_105_plan.json",
    "invariants": "benchmark/gold/invariants/PUB_105_invariants.json"
  },
  "tags": [
    "public",
    "openapi",
    "finance",
    "payment",
    "grouped-execution",
    "aggregation"
  ],
  "downstream_checks": [
    {
      "type": "record_count_matches_expected"
    },
    {
      "type": "required_fields_present",
      "fields": [
        "customer_id",
        "currency",
        "payment_count",
        "total_amount_minor",
        "first_payment_time",
        "last_payment_time"
      ],
      "scope": "all_records"
    },
    {
      "type": "field_types",
      "fields": {
        "customer_id": "string",
        "currency": "string",
        "payment_count": "integer",
        "total_amount_minor": "number",
        "first_payment_time": "datetime-string",
        "last_payment_time": "datetime-string"
      },
      "scope": "all_records"
    }
  ],
  "notes": [
    "Public anchor task.",
    "Hand-built public task generated by build_public_tasks.py."
  ]
}