{
  "task_id": "SYN_301",
  "title": "Join primitive: orders with customers (left join)",
  "split": "synthetic",
  "difficulty": "medium",
  "source_family": "synthetic_join_order_customer",
  "target_entity": "order_with_customer",
  "task_text": "Create one canonical order_with_customer object per order by joining orders with customers on customer_id = id using a left join.",
  "primitive_family": "join",
  "primitive_subtype": "left",
  "lexical_perturbation": "none",
  "ambiguity_class": "single_gold",
  "composition_depth": 1,
  "difficulty_axes": {
    "num_source_objects": 2,
    "num_target_fields": 7,
    "num_joins": 1,
    "num_aggregations": 0,
    "nesting_depth": 1,
    "has_enum_normalization": false,
    "has_time_normalization": false
  },
  "source_schema": {
    "type": "object",
    "title": "OrderCustomerBundle",
    "properties": {
      "orders": {
        "type": "array",
        "items": {
          "type": "object",
          "title": "OrdersRow",
          "properties": {
            "id": {
              "type": "string"
            },
            "customer_id": {
              "type": "string"
            },
            "status": {
              "type": "string"
            },
            "total_amount": {
              "type": "number"
            }
          },
          "required": [
            "id",
            "customer_id",
            "status",
            "total_amount"
          ],
          "additionalProperties": false
        }
      },
      "customers": {
        "type": "array",
        "items": {
          "type": "object",
          "title": "CustomersRow",
          "properties": {
            "id": {
              "type": "string"
            },
            "email": {
              "type": "string"
            },
            "country": {
              "type": "string"
            },
            "tier": {
              "type": "string"
            }
          },
          "required": [
            "id",
            "email",
            "country",
            "tier"
          ],
          "additionalProperties": false
        }
      }
    },
    "required": [
      "orders",
      "customers"
    ],
    "additionalProperties": false
  },
  "target_schema": {
    "type": "object",
    "title": "OrderWithCustomer",
    "properties": {
      "order_id": {
        "type": "string"
      },
      "customer_id": {
        "type": "string"
      },
      "customer_email": {
        "type": [
          "string",
          "null"
        ]
      },
      "customer_country": {
        "type": [
          "string",
          "null"
        ]
      },
      "customer_tier": {
        "type": [
          "string",
          "null"
        ]
      },
      "order_status": {
        "type": "string"
      },
      "total_amount": {
        "type": "number"
      }
    },
    "required": [
      "order_id",
      "customer_id",
      "customer_email",
      "customer_country",
      "customer_tier",
      "order_status",
      "total_amount"
    ],
    "additionalProperties": false
  },
  "fixture_refs": {
    "input": "../../../fixtures/synthetic/SYN_301_input.json",
    "expected": "../../../fixtures/synthetic/SYN_301_expected.json"
  },
  "gold_refs": {
    "matches": "../../../gold/matches/SYN_301_matches.json",
    "plan": "../../../gold/plans/SYN_301_plan.json",
    "invariants": "../../../gold/invariants/SYN_301_invariants.json"
  },
  "tags": [
    "synthetic",
    "primitive",
    "join",
    "left",
    "commerce"
  ],
  "notes": [
    "Synthetic join primitive.",
    "Bundle-shaped join task."
  ],
  "downstream_checks": [
    {
      "type": "record_count_matches_expected"
    },
    {
      "type": "required_fields_present",
      "fields": [
        "order_id",
        "customer_id",
        "order_status",
        "total_amount"
      ],
      "scope": "all_records"
    },
    {
      "type": "field_types",
      "fields": {
        "order_id": "string",
        "customer_id": "string",
        "customer_email": "string-or-null",
        "customer_country": "string-or-null",
        "customer_tier": "string-or-null",
        "order_status": "string",
        "total_amount": "number"
      },
      "scope": "all_records"
    }
  ]
}