{
  "task_id": "PUB_101",
  "title": "Map FHIR Patient to gamebus_player_profile",
  "split": "public",
  "difficulty": "easy",
  "source_family": "fhir_patient",
  "target_entity": "gamebus_player_profile",
  "task_text": "Create one GameBus-like player profile JSON object from one FHIR Patient resource.",
  "source_schema": {
    "type": "object",
    "properties": {
      "resourceType": {
        "type": "string",
        "const": "Patient"
      },
      "id": {
        "type": "string"
      },
      "gender": {
        "type": "string"
      },
      "birthDate": {
        "type": "string"
      },
      "name": {
        "type": "array",
        "items": {
          "type": "object",
          "properties": {
            "family": {
              "type": "string"
            },
            "given": {
              "type": "array",
              "items": {
                "type": "string"
              }
            }
          },
          "additionalProperties": false
        }
      },
      "address": {
        "type": "array",
        "items": {
          "type": "object",
          "properties": {
            "country": {
              "type": "string"
            }
          },
          "additionalProperties": false
        }
      }
    },
    "additionalProperties": false,
    "required": [
      "resourceType",
      "id",
      "gender",
      "birthDate",
      "name"
    ],
    "title": "FHIRPatient"
  },
  "target_schema": {
    "type": "object",
    "properties": {
      "player_external_id": {
        "type": "string"
      },
      "first_name": {
        "type": "string"
      },
      "last_name": {
        "type": "string"
      },
      "gender": {
        "type": "string"
      },
      "birth_date": {
        "type": "string"
      },
      "country": {
        "type": [
          "string",
          "null"
        ]
      }
    },
    "additionalProperties": false,
    "required": [
      "player_external_id",
      "first_name",
      "last_name",
      "gender",
      "birth_date"
    ],
    "title": "GameBusPlayerProfile"
  },
  "fixture_refs": {
    "input": "benchmark/fixtures/public/PUB_101_input.json",
    "expected": "benchmark/fixtures/public/PUB_101_expected.json"
  },
  "gold_refs": {
    "matches": "benchmark/gold/matches/PUB_101_matches.json",
    "plan": "benchmark/gold/plans/PUB_101_plan.json",
    "invariants": "benchmark/gold/invariants/PUB_101_invariants.json"
  },
  "tags": [
    "public",
    "fhir",
    "interop",
    "gamebus-shaped",
    "patient"
  ],
  "notes": [
    "Public anchor task.",
    "Hand-built public task generated by build_public_tasks.py."
  ]
}