{
  "task_id": "SYN_108",
  "title": "Copy/rename primitive: steps / synonym",
  "split": "synthetic",
  "difficulty": "easy",
  "source_family": "synthetic_copy_rename",
  "target_entity": "canonical_activity_summary",
  "task_text": "Map source field 'step_count' to target field 'steps'.",
  "primitive_family": "copy_rename",
  "primitive_subtype": "synonym",
  "lexical_perturbation": "synonym",
  "ambiguity_class": "single_gold",
  "composition_depth": 1,
  "difficulty_axes": {
    "num_source_objects": 1,
    "num_target_fields": 1,
    "num_joins": 0,
    "num_aggregations": 0,
    "nesting_depth": 0,
    "has_enum_normalization": false,
    "has_time_normalization": false
  },
  "source_schema": {
    "type": "object",
    "title": "SYN_108Source",
    "properties": {
      "step_count": {
        "type": "integer"
      }
    },
    "required": [
      "step_count"
    ],
    "additionalProperties": false
  },
  "target_schema": {
    "type": "object",
    "title": "SYN_108Target",
    "properties": {
      "steps": {
        "type": "integer"
      }
    },
    "required": [
      "steps"
    ],
    "additionalProperties": false
  },
  "fixture_refs": {
    "input": "../../../fixtures/synthetic/SYN_108_input.json",
    "expected": "../../../fixtures/synthetic/SYN_108_expected.json"
  },
  "gold_refs": {
    "matches": "../../../gold/matches/SYN_108_matches.json",
    "plan": "../../../gold/plans/SYN_108_plan.json",
    "invariants": "../../../gold/invariants/SYN_108_invariants.json"
  },
  "tags": [
    "synthetic",
    "primitive",
    "copy_rename",
    "steps",
    "synonym"
  ],
  "notes": [
    "Common synonym."
  ],
  "downstream_checks": [
    {
      "type": "required_fields_present",
      "fields": [
        "steps"
      ],
      "scope": "all_records"
    }
  ]
}