{
  "task_id": "GB_002",
  "title": "Map DAY_AGGREGATE to daily_activity_summary",
  "split": "gamebus",
  "difficulty": "easy",
  "source_family": "gamebus",
  "target_entity": "daily_activity_summary",
  "task_text": "Map one GameBus DAY_AGGREGATE record into one normalized daily activity summary object.",
  "source_schema": {
    "descriptor_name": "day_aggregate",
    "source_file": "C:\\Users\\sonok\\Documents\\Github\\llm-schema-mapping-benchmark\\data\\raw_private\\gamebus\\player_449_day_aggregate.json",
    "top_level_type": "list",
    "record_count": 83,
    "field_count": 5,
    "benchmark_family_hint": "flat_descriptor_normalization",
    "fields": [
      {
        "name": "DISTANCE_SUM",
        "raw_type_counts": {
          "str": 83
        },
        "logical_type_hints": [
          "numeric_string"
        ],
        "recommended_operations": [
          "copy",
          "cast_number"
        ],
        "examples": [
          "1028.328125",
          "2671.640625",
          "14995.25",
          "6045.453125",
          "13646.8984375"
        ],
        "null_count": 0
      },
      {
        "name": "PA_CAL_SUM",
        "raw_type_counts": {
          "str": 83
        },
        "logical_type_hints": [
          "integer_string",
          "numeric_string"
        ],
        "recommended_operations": [
          "copy",
          "cast_integer"
        ],
        "examples": [
          "50",
          "126",
          "727",
          "290",
          "653"
        ],
        "null_count": 0
      },
      {
        "name": "STEPS_SUM",
        "raw_type_counts": {
          "str": 83
        },
        "logical_type_hints": [
          "integer_string",
          "numeric_string"
        ],
        "recommended_operations": [
          "copy",
          "cast_integer"
        ],
        "examples": [
          "1384",
          "3566",
          "20425",
          "8196",
          "18604"
        ],
        "null_count": 0
      },
      {
        "name": "X_ACTIVITY_ID",
        "raw_type_counts": {
          "int": 83
        },
        "logical_type_hints": [],
        "recommended_operations": [
          "copy"
        ],
        "examples": [
          1026583,
          1026582,
          1026581,
          1026580,
          1026579
        ],
        "null_count": 0
      },
      {
        "name": "X_DATE",
        "raw_type_counts": {
          "str": 83
        },
        "logical_type_hints": [
          "datetime_string"
        ],
        "recommended_operations": [
          "copy",
          "parse_datetime",
          "truncate_date"
        ],
        "examples": [
          "2025-06-04 00:59:59",
          "2025-06-03 00:59:59",
          "2025-06-02 00:59:59",
          "2025-06-01 00:59:59",
          "2025-05-31 00:59:59"
        ],
        "null_count": 0
      }
    ]
  },
  "target_schema": {
    "target_entity": "daily_activity_summary",
    "fields": [
      {
        "name": "source_activity_id",
        "type": "integer",
        "required": true
      },
      {
        "name": "date",
        "type": "date",
        "required": true
      },
      {
        "name": "steps_sum",
        "type": "integer",
        "required": true
      },
      {
        "name": "distance_sum_m",
        "type": "number",
        "required": true
      },
      {
        "name": "pa_cal_sum_kcal",
        "type": "integer",
        "required": true
      }
    ]
  },
  "fixture_refs": {
    "input": "benchmark/fixtures/gamebus/GB_002_input.sample.json",
    "expected": "benchmark/fixtures/gamebus/GB_002_expected.sample.json"
  },
  "gold_refs": {
    "matches": "benchmark/gold/matches/GB_002_matches.json",
    "plan": "benchmark/gold/plans/GB_002_plan.json",
    "invariants": "benchmark/gold/invariants/GB_002_invariants.json"
  },
  "tags": [
    "gamebus",
    "activity",
    "aggregate",
    "flat_descriptor_normalization"
  ],
  "notes": [
    "Auto-generated from descriptor profile. Review before release.",
    "Fixtures are samples only. Expected outputs may still need manual refinement."
  ]
}