{
  "task_id": "SYN_007",
  "title": "Group session route events into a route summary",
  "split": "synthetic",
  "difficulty": "hard",
  "source_family": "synthetic_session_route_event",
  "target_entity": "synthetic_session_route_summary",
  "task_text": "Group route events by session and compute visit statistics.",
  "source_schema": {
    "type": "object",
    "title": "SyntheticSessionRouteEvent",
    "properties": {
      "event_id": {
        "type": "integer"
      },
      "session_id": {
        "type": "string"
      },
      "route": {
        "type": "string"
      },
      "event_time": {
        "type": "string"
      }
    },
    "required": [
      "event_id",
      "session_id",
      "route",
      "event_time"
    ],
    "additionalProperties": false
  },
  "target_schema": {
    "type": "object",
    "title": "SyntheticSessionRouteSummary",
    "properties": {
      "session_id": {
        "type": "string"
      },
      "page_visit_count": {
        "type": "integer"
      },
      "first_route": {
        "type": "string"
      },
      "last_route": {
        "type": "string"
      },
      "distinct_route_count": {
        "type": "integer"
      }
    },
    "required": [
      "session_id",
      "page_visit_count",
      "first_route",
      "last_route",
      "distinct_route_count"
    ],
    "additionalProperties": false
  },
  "fixture_refs": {
    "input": "../../../fixtures/synthetic/SYN_007_input.json",
    "expected": "../../../fixtures/synthetic/SYN_007_expected.json"
  },
  "gold_refs": {
    "matches": "../../../gold/matches/SYN_007_matches.json",
    "plan": "../../../gold/plans/SYN_007_plan.json",
    "invariants": "../../../gold/invariants/SYN_007_invariants.json"
  },
  "tags": [
    "synthetic",
    "grouped-execution",
    "session-summary",
    "hard"
  ],
  "downstream_checks": [],
  "notes": [
    "Synthetic native task.",
    "Generated by scripts/generate_synthetic_tasks.py."
  ]
}
